{
  "id": "assepsia",
  "knowledgeType": "ClinicalConcept",
  "library": "conceitos",
  "version": "1.0.0",
  "status": "published",
  "identity": {
    "name": "Assepsia",
    "slug": "assepsia",
    "category": "Conceitos Clínicos",
    "subcategory": "Biossegurança",
    "description": "Conjunto de medidas destinadas a evitar a introdução de microrganismos em tecidos ou ambientes estéreis.",
    "shortDescription": "Prevenção da introdução de microrganismos em campo estéril.",
    "tags": [
      "assepsia",
      "antissepsia",
      "esterilizacao",
      "biosseguranca",
      "enfermagem"
    ],
    "language": "pt-BR"
  },
  "core": {
    "runtime": {
      "components": [
        "KnowledgeHeader",
        "DefinitionCard",
        "Examples",
        "RelatedConcepts",
        "MistakenConcepts",
        "ClinicalApplication",
        "KnowledgeGraph"
      ]
    },
    "knowledgeGraph": {
      "relatedObjects": [
        "antissepsia",
        "esterilizacao",
        "desinfeccao",
        "puncao-venosa",
        "protocolo-sepse"
      ]
    }
  },
  "domainPayload": {
    "definition": "Conjunto de técnicas e procedimentos que visam impedir a contaminação de feridas, materiais ou campos cirúrgicos por microrganismos, através da ausência de germes.",
    "examples": [
      "Lavagem das mãos antes de procedimento invasivo",
      "Uso de campo estéril durante punção venosa",
      "Técnica de abertura de material estéril",
      "Uso de luvas estéreis em cirurgia"
    ],
    "relatedConcepts": [
      {
        "concept": "Antissepsia",
        "relationship": "Complementar",
        "description": "Redução da carga microbiana em pele ou mucosas (ex: clorexidina, álcool)"
      },
      {
        "concept": "Esterilização",
        "relationship": "Instrumento",
        "description": "Eliminação de todos os microrganismos, incluindo esporos"
      },
      {
        "concept": "Desinfecção",
        "relationship": "Instrumento",
        "description": "Eliminação de microrganismos patogênicos em objetos, exceto esporos"
      },
      {
        "concept": "Asepsia médica",
        "relationship": "Modalidade",
        "description": "Assepsia em ambiente hospitalar (ex: UTI, centro cirúrgico)"
      }
    ],
    "mistakenConcepts": [
      {
        "error": "Confundir assepsia com antissepsia",
        "correction": "Assepsia = ausência de germes no ambiente/objeto; Antissepsia = redução de germes na pele"
      },
      {
        "error": "Achar que assepsia elimina todos os germes",
        "correction": "Assepsia previne introdução; esterilização é que elimina todos"
      }
    ],
    "clinicalApplication": [
      "Punção venosa",
      "Administração de medicamentos parenterais",
      "Curativos em feridas limpas",
      "Procedimentos cirúrgicos",
      "Inserção de sondas"
    ]
  }
}