{
  "id": "caso-sepse-01",
  "knowledgeType": "Education",
  "library": "educacao",
  "version": "1.0.0",
  "status": "published",
  "identity": {
    "name": "Caso Clínico: Sepse em UTI",
    "slug": "caso-sepse-01",
    "category": "Educação",
    "subcategory": "Caso Clínico",
    "description": "Caso clínico interativo de paciente com sepse grave em UTI.",
    "shortDescription": "Caso interativo de sepse para treinamento.",
    "tags": [
      "caso-clinico",
      "sepse",
      "educacao",
      "simulacao",
      "uti"
    ],
    "language": "pt-BR"
  },
  "core": {
    "runtime": {
      "components": [
        "KnowledgeHeader",
        "LearningObjectives",
        "LearningPath",
        "Quiz",
        "ClinicalCases",
        "SimulationViewer",
        "MemoryAid",
        "StudyGuide",
        "KnowledgeGraph"
      ]
    },
    "knowledgeGraph": {
      "relatedObjects": [
        "sepse",
        "protocolo-sepse",
        "escala-sofa",
        "ceftriaxona",
        "vancomicina"
      ]
    }
  },
  "domainPayload": {
    "difficulty": "advanced",
    "learningObjectives": [
      "Reconhecer sinais de sepse precoce",
      "Aplicar bundle de 1h",
      "Selecionar antibioticoterapia empírica",
      "Interpretar lactato e SOFA"
    ],
    "questions": [
      {
        "id": "q1",
        "question": "Paciente 68a, febre 38,8°C, FC 112, FR 24, PAS 95/60, lactato 3,2. Qual a conduta IMEDIATA?",
        "options": [
          "Aguardar culturas para antibioticoterapia",
          "Iniciar cristaloides 30mL/kg e antibióticos",
          "Somente vasopressores",
          "Solicitar TC de abdome"
        ],
        "correct": 1,
        "rationale": "Bundle de 1h: fluidos + antibióticos imediatos."
      },
      {
        "id": "q2",
        "question": "Após 3h, lactato 4,5 e PAS 85. Qual próximo passo?",
        "options": [
          "Mais 30mL/kg",
          "Noradrenalina",
          "Hidrocortisona",
          "Dialise"
        ],
        "correct": 1,
        "rationale": "Choque refratário a fluidos requer vasopressores."
      }
    ],
    "answers": [
      {
        "id": "q1",
        "correct": 1,
        "explanation": "..."
      },
      {
        "id": "q2",
        "correct": 1,
        "explanation": "..."
      }
    ],
    "learningPath": [
      "Leitura do caso",
      "Responder perguntas",
      "Revisar protocolo",
      "Simulação de decisão",
      "Avaliação final"
    ]
  }
}