{
  "id": "nove-certos",
  "knowledgeType": "PatientSafety",
  "library": "seguranca-paciente",
  "version": "1.0.0",
  "status": "published",
  "identity": {
    "name": "9 Certos da Medicação",
    "slug": "nove-certos",
    "category": "Segurança do Paciente",
    "subcategory": "Farmacoterapia",
    "description": "Conjunto de verificações obrigatórias antes de administrar qualquer medicamento.",
    "shortDescription": "9 verificações para administração segura de medicamentos.",
    "tags": [
      "9-certos",
      "seguranca",
      "medicacao",
      "enfermagem",
      "checklist"
    ],
    "language": "pt-BR"
  },
  "core": {
    "runtime": {
      "components": [
        "KnowledgeHeader",
        "Recommendations",
        "Alerts",
        "Checklist",
        "InternationalGoals",
        "NeverEvents",
        "HighAlertMedication",
        "NineRights",
        "DoubleCheck",
        "KnowledgeGraph"
      ]
    },
    "knowledgeGraph": {
      "relatedObjects": [
        "nic-2312",
        "administracao-medicamentos",
        "heparina",
        "insulina",
        "noradrenalina"
      ]
    }
  },
  "domainPayload": {
    "recommendations": [
      "Verificar os 9 certos em TODA administração",
      "Realizar conferência dupla para medicamentos de alta vigilância",
      "Documentar após administração, não antes"
    ],
    "alerts": [
      "Erro de medicação é o evento adverso mais frequente em hospitais",
      "Medicamentos de mesma embalagem ou nome similar são de alto risco"
    ],
    "checklist": {
      "nineRights": [
        {
          "right": 1,
          "item": "Paciente correto",
          "verification": "2 identificadores (nome completo + data de nascimento ou prontuário)"
        },
        {
          "right": 2,
          "item": "Medicamento correto",
          "verification": "Conferir nome com prescrição; cuidado com look-alike/sound-alike"
        },
        {
          "right": 3,
          "item": "Dose correta",
          "verification": "Conferir unidade, concentração e volume; calcular se necessário"
        },
        {
          "right": 4,
          "item": "Via correta",
          "verification": "EV, IM, SC, VO, retal, tópica, etc."
        },
        {
          "right": 5,
          "item": "Horário correto",
          "verification": "Frequência prescrita; atraso aceitável conforme política"
        },
        {
          "right": 6,
          "item": "Documentação correta",
          "verification": "Registrar após administração; anotar recusa ou omissão"
        },
        {
          "right": 7,
          "item": "Ação correta",
          "verification": "Motivo da prescrição; contraindicações; interações"
        },
        {
          "right": 8,
          "item": "Forma correta",
          "verification": "Comprimido, cápsula, solução, injetável, etc."
        },
        {
          "right": 9,
          "item": "Resposta correta",
          "verification": "Monitorar efeito terapêutico e efeitos adversos"
        }
      ]
    },
    "neverEvents": [
      "Administração de medicamento ao paciente errado",
      "Via errada (ex: EV quando deveria ser IM)",
      "Dose 10x maior ou menor"
    ],
    "highAlertMedications": [
      "Insulina",
      "Heparina",
      "Noradrenalina",
      "Potássio",
      "Morfina",
      "Quimioterápicos"
    ]
  }
}